{
  "schemaVersion": 1,
  "matterId": "INT-20260901-022-thorn-batch",
  "binding": {
    "schemaVersion": 1,
    "profileId": "requirement-analysis",
    "profileVersion": "v1.0.0",
    "matterId": "INT-20260901-022-thorn-batch"
  },
  "inputs": {
    "request": "维护者原话「修」——指示执行修小刺批次：把已登记但一直没动的小缺陷与清扫级死代码集中处置一轮。范围条目见 INT-20260901-022-thorn-batch 的 Triage 节（009、010、011、012、016、017、018、007 的 DEP0190 遗留项、清扫级死代码）；另两个议题（消费仓 agent-system 工作树残留的去留、两仓 main 分支保护规则是否统一）只作开放问题记录，不进修复范围。",
    "problemFrame": {
      "problem": "九类已登记的小缺陷长期挂账未处置。它们单独看都不影响已交付合同的正确性，合起来却造成两个实质后果：其一，Windows 本地「全量测试绿」这一完成标准已不可稳定达成（升级冒烟的失败在维护者环境下是多数情形），使得「复跑两次全绿即通过」的既有判据形同虚设；其二，受管投影从 Runtime 分发到消费仓的链路上存在三处可静默带病提交的盲区（ignore 规则吞投影、index 软链模式坏账、投影副本不可作入口），坏账要等他人 clone 后才暴露。此外，其中最吵的一条（升级冒烟偶发失败）此前被归因为 git racy 竞态，导致候选修法一直停留在「加重试」这一治标方向。",
      "goals": [
        "让 Windows 本地全量合同测试可稳定绿，恢复「全量测试绿」作为可用的完成标准。",
        "把三处投影分发盲区从「靠人记得核对」改为机器 fail-closed，或明确收缩合同使盲区不再成立。",
        "清掉零消费的死代码与固定出现的告警噪音，使 CLI 输出可直接作为机器与人的判据。",
        "每条刺都留下可复核的证据链：归因由实测而非推断给出，修法与归因对齐。"
      ],
      "scope": {
        "in": [
          "openspec/tools/** 的可执行行为与 test/** 的配套断言（tool-code 档）",
          "归档证据的路径长度预算与命名约定",
          "仓库 .gitattributes 的行尾覆盖面（候选，是否做待裁）",
          ".omp/commands/*.md 正文中的入口路径写法（仅在 018 走收缩路线时触及）"
        ],
        "out": [
          "消费仓 agent-system 自身的工作树残留去留（另记开放问题）",
          "两仓 main 分支保护规则是否统一（另记开放问题）",
          "流水线形状与站位增删（属复盘议题，不在本批次）",
          "本轮不实施任何修复，止于方案提案起草"
        ]
      },
      "constraints": [
        "路由表按 changeObject=tool-code 判定必走完整 delivery-change 档，不可自述豁免或降档。",
        "CI 只在 ubuntu 上跑，四条 Windows 刺在 CI 上不可见；验收证据只能来自本地实测，且必须给出可复现的判据而非「重跑就好了」。",
        "声明与事实交叉校验（verifyDeclaredScope）会按路由表的路径前缀核对实际改动面：本批次若触及 .gitattributes 或 .github/**，这些路径在现行路由表中无任何前缀命中、按未匹配取最重档（档位序 99），会直接判定与 tool-code（档位序 20）的声明不符而 fail-closed。这是硬前置条件，不是可绕过项。",
        "归档证据路径长度本身是被修对象之一，本 Change 自己产出的验收证据不得再踩同一预算。",
        "不得为迁就 changeObject 声明而缩小改动面——正确处置是修正声明并补该档分析线，或按路由表自述的口径调表。"
      ]
    },
    "capabilityReport": {
      "known": [
        "升级冒烟失败的成因已由受控探针实证，且推翻了原登记的 git racy 竞态归因：在临时目录构造同名同长的归档证据路径、逐档改变仓根长度后跑 git status --porcelain，阈值确定——全路径长度 259 及以下报告干净，260 及以上同一份未改动文件被报为 M；同一路径加 -c core.longpaths=true 后恒为干净。",
        "溢出点可算且与实测吻合：最长归档证据路径为 155 字符，临时根前缀加 consumer-webcoding-spec 加 .delivery-spec-runtime 后正好把它推到 260；三次连跑复现 2 过 1 败，失败侧恒为 consumer 序号 1（webcoding-spec，前缀最长者）。",
        "两个 git 调用点能力不一致：openspec-upgrade.ts 的 git() 在 win32 上已固定加 -c core.longpaths=true，runtime-entry.ts 的 git() 没有。冒烟里做检出的是前者（写得进去），做 status 判 dirty 的是后者（读不出来）。",
        "失败原因当前不可追溯：consumerSmoke 拿到 runtimeCheck.stderr 却不写进 upgrade report，报告里只有 runtimeStatus: 1。这是该刺被长期当成噪音的直接原因。",
        "投影副本不可作入口已实证：把受管投影里的 runtime-entry.ts 单独放进一个没有 runtime-manifest.json 的目录树并调用，稳定报「Runtime 源仓缺少 runtime-manifest.json」；代码侧确认 sourceRootFromScript() 在 resolveBinding() 第一行被无条件调用，消费仓回落分支没有机会执行。",
        "该刺的放大面已量得：九个 opsx 命令文档中有 17 条真实命令行写死 planningHome.root 加 openspec/tools/runtime-entry.ts 形态，分布在 apply 4、archive 5、continue 4、new 1、sync 1、verify 2；每文件另有一条前言注释同时列出两种形态，前言写法本身正确。",
        "ignore 吞投影与 index 软链模式两处盲区在代码侧确认：verifyLinks() 只比对工作树 treeDigest，既不查 git check-ignore，也不查 index 中的文件模式。",
        "消费仓侧的 runtime-check 本来就强依赖 git（同一函数链里已有四处硬调用，任一失败即 fail-closed），故两条目里悬着的「无 git 消费场景如何降级」这一前置疑问事实上不存在。",
        "CRLF 现状：仓内 .gitattributes 仍只有 *.json text eol=lf 一行，未覆盖 .md 与 .ts；本机 core.autocrlf 为 true。受管投影校验之所以仍成立，全靠 treeDigest() 里的一次行尾归一化。",
        "死代码实测清单：bootstrap.ts 的 statSync、basename、sha256Buffer；intake-control.ts 的 requiredOption；public-candidate.ts 的 readdirSync；另有 runtime-lib.ts 的 findUp、gitCommit、ensureInside 三个导出函数在 tools 与 test 两处全文检索均无第二处引用。",
        "DEP0190 恒定出现：本条目自身的 intake init 与 workflow bind 调用都在 JSON 输出后打出该告警，来源是 runtime-entry.ts 用 shell 选项调 openspec 取版本。",
        "CI 只跑 ubuntu-latest，四条 Windows 刺在 CI 上永远不可见。",
        "全量合同测试当前 79 项一次通过——九类刺全部不在现有断言覆盖面上，这本身即缺口证据。"
      ],
      "unknown": [
        "升级冒烟为何是 2 过 1 败而非恒败：算得的溢出点正好落在 260 这个边界值上，本应确定失败。残留猜想是 Windows 上 git 的 fscache 或索引 stat 缓存使某些跑次绕过了越限的 lstat。触发条件与阈值已实证，不影响修法选择，故不再深挖。",
        "投影入口命令行处数与原台账记录的 19 处对不上（本轮量得 17 处），差额疑为计数口径（是否计入前言注释与跨行续行）。不影响两条路线取舍。",
        "Windows 临时目录 EPERM 的归因仍是猜测（反病毒或索引器短暂持锁），本轮未复现、未取证。按有限退避重试处置无须先证实该假设；要做根因处置则必须先取证。",
        "把 .md 与 .ts 钉成 eol=lf 后，core.autocrlf=true 的工作树会在下一次 git 触碰时整批重写行尾，可能产生一次大面积的形式化 diff。本轮未做影响面测算。",
        "归档证据路径若改缩名约定，是否要回溯既有归档目录（改写历史治理证据）尚未定；倾向只约束新证据。"
      ],
      "evidence": [
        "受控路径探针：250 / 255 / 258 / 259 / 260 / 261 / 265 / 270 八档总长，git status --porcelain 在 260 起报 M，加 longpaths 后恒净。",
        "升级冒烟三次连跑：2 过 1 败，失败侧 runtimeStatus 序列为 0 / 1 / 0。",
        "投影入口探针：孤立副本调用稳定报「Runtime 源仓缺少 runtime-manifest.json」。",
        "未用导入与零调用导出的全文回扫结果（去掉导入语句本身后计数为零者）。",
        "分支保护实况对比（gh api 取两仓 main 的 protection）。",
        "源码：runtime-entry.ts、openspec-upgrade.ts、runtime-lib.ts、intake-control.ts、bootstrap.ts、public-candidate.ts、test/openspec-upgrade.test.ts、.omp/commands/、.gitattributes、.github/workflows/ci.yml。",
        "台账：INT-20260831-009 / 010 / 011 / 012 / 016 / 017 / 018，以及 INT-20260831-007 的 Disposition 段。"
      ],
      "confidence": "高（对 010、011、017、018 与死代码清单：均有本轮受控实测或代码侧确定性确认）；中（对 009 的 .gitattributes 扩展：方向清楚但影响面未测算）；低（对 012：归因仍为未取证猜测，只有症状缓解方案是可靠的）。"
    },
    "optionReport": {
      "options": [
        {
          "id": "批次层面 A",
          "name": "整批立项为一个 Change",
          "detail": "九类刺共享同一套测试与同一条受管投影分发链，合并处置只付一次验收与归档开销；010 与 011 已实测同源，本就必须同批。Review 按刺分组以控制单次审查面。"
        },
        {
          "id": "批次层面 B",
          "name": "拆成三个 Change（Windows 环境族 / 投影分发族 / 清扫族）",
          "detail": "每个 Change 更聚焦、Review 更易，但要付三次完整交付仪式；且 010 加 011 与 009 的行尾话题会被切开，而它们同属「Windows 检出与路径能力」这一根因面。"
        },
        {
          "id": "批次层面 C",
          "name": "按 light-change 快车道逐条修",
          "detail": "最省仪式，但路由表已判定 tool-code 必走完整档。此路不通不是取舍问题而是门禁问题，列出仅为说明为何不走。"
        },
        {
          "id": "010+011 修法 甲",
          "name": "只治读侧：给 runtime-entry.ts 的 git 调用补 longpaths",
          "detail": "与 openspec-upgrade.ts 已有做法对齐，一处改动即消除误判。不缩短任何路径，预算余量仍为零。"
        },
        {
          "id": "010+011 修法 乙",
          "name": "只治长度：给归档证据定路径长度预算并缩名",
          "detail": "把最长的 155 字符压到预算内（如 120），并加一条测试断言守住预算。根治溢出，但对既有归档目录是否回溯需另裁；且不改读侧能力，未来别处再超长仍会误判。"
        },
        {
          "id": "010+011 修法 丙",
          "name": "甲加乙，并把 runtimeCheck.stderr 写进 upgrade report",
          "detail": "读侧能力对齐、长度预算成文、失败原因可追溯三件一起做。投入最大但把「为什么失败」这一诊断缺口也补上——正是这个缺口让该刺被误归因并挂了这么久。"
        },
        {
          "id": "009 修法 甲",
          "name": "只扩 .gitattributes 到 .md 与 .ts",
          "detail": "从源头缩小 CRLF 进入受管投影的机会。触及 .gitattributes，在现行路由表中无前缀命中，会撞上声明与事实交叉校验（见风险节）。"
        },
        {
          "id": "009 修法 乙",
          "name": "只把行尾归一化升格为显式行为要求",
          "detail": "在长期 spec 里写明「受管投影摘要必须做行尾归一化」，使其不可被当作实现细节重构掉，并补一条断言守住。不改 .gitattributes，不触发路由问题。"
        },
        {
          "id": "009 修法 丙",
          "name": "甲加乙",
          "detail": "既保护既有成立路径又缩小产生面。需先处理路由表对 .gitattributes 的空白。"
        },
        {
          "id": "016 修法 甲",
          "name": "文档侧：消费指南加检查项",
          "detail": "成本最低，但把正确性寄托在人记得照做上；而这条刺恰恰是「靠人核对」失效的产物。"
        },
        {
          "id": "016 修法 乙",
          "name": "工具侧：runtime-check 对受管路径跑 git check-ignore 断言",
          "detail": "命中即 fail-closed。消费仓侧本来就强依赖 git，无新增依赖；文档侧可退为解释性说明。"
        },
        {
          "id": "017 修法",
          "name": "runtime-check 增加 index 文件模式断言",
          "detail": "断言受管投影在 git index 中的模式不得为 120000，命中即 fail-closed。与现有「只查工作树摘要」互补，摘要相同而模式错误正是当前盲区。无对立候选，只有做与不做。"
        },
        {
          "id": "018 路线 甲",
          "name": "修复入口：sourceRootFromScript() 找不到 manifest 时回落 findConsumerRoot()",
          "detail": "让投影副本在消费仓侧也能作入口，恢复软链时代行为。17 条命令行不必改，opsx 文档保持单一形态。代价：入口的定位逻辑从「一种形态」变成「两种形态择一」，需要新增断言钉死回落的边界，否则会掩盖真正的未初始化错误。"
        },
        {
          "id": "018 路线 乙",
          "name": "收缩合同：声明投影副本非入口，并把 17 条命令行统一改为消费仓形态",
          "detail": "入口逻辑保持单一，语义更干净。代价：改动落在 .omp/**，属治理合同档（档位序 30），高于本条目声明的 tool-code（20），会直接触发声明与事实交叉校验的拒绝——须先修正 changeObject 声明并补该档分析线。且投影副本从此是「只给人和 IDE 看的引用」，需要一句明确的合同表述说明它为何仍被投影。"
        },
        {
          "id": "012 修法",
          "name": "临时目录清理加有限退避重试",
          "detail": "症状缓解，不依赖未取证的归因。若要根因处置需先取证，本轮不建议。"
        },
        {
          "id": "DEP0190 修法",
          "name": "去掉 shell 选项，改用平台相应的可执行名直调",
          "detail": "一处改动，输出即干净。风险是 win32 上 openspec 的实际可执行形态需确认（.cmd 还是 .exe），须以探针取证而非假定。"
        },
        {
          "id": "死代码修法",
          "name": "删除五个未用导入与三个零调用导出",
          "detail": "纯减法。三个导出函数需再确认无外部消费者（本仓是公开共享运行时，导出即公开面），确认后删；若判定为预留公开 API 则应改为显式登记而非无声留存。"
        }
      ],
      "tradeoffs": [
        "批次 A 对 B：A 省两次交付仪式并保住 009/010/011 的根因同面性，代价是单次 Review 面偏宽；B 反之。考虑到九类刺合计改动量小于一次交付仪式的开销，A 的性价比明显更高。",
        "010+011 甲对乙对丙：甲最省且立竿见影，但预算余量仍为零，下一条长路径会再犯；乙根治长度但读侧能力仍落后于写侧；丙把三件一起做，并额外解决「失败不可追溯」——这是唯一能防止该刺再次被误归因的一项。",
        "009 甲对乙：乙保护的是「现在为什么能成立」，甲缩小的是「未来还会不会发生」，两者不互替。甲的代价是一次大面积形式化 diff 加路由表空白；乙无副作用但不减少 CRLF 产生面。",
        "016 甲对乙：这条刺的成因就是人没核对，用「再加一条要人核对的检查项」处置属同义反复；乙把它换成机器强制，且无新增依赖。",
        "018 甲对乙：甲保行为兼容、改动小、不触发档位问题，但让入口定位多一条回落路径，有掩盖真错误的风险；乙语义更干净但触发档位不符、需要先改声明补分析线，且要为「为什么还要投影一个不可执行的副本」给出说法。两者方向相反，必须先裁定「投影副本到底算不算入口」这个定位问题。"
      ],
      "investment": "整批一个 Change：代码改动集中在 runtime-entry.ts（longpaths、check-ignore 断言、index 模式断言、DEP0190、可能的入口回落）、openspec-upgrade.ts（stderr 入报告）、三个文件的死代码清理，加配套断言与一次本地全量验收。绝大部分是小改动，成本集中在验收侧：四条 Windows 刺在 CI 上不可见，必须给出本地可复现的判据（受控路径探针可直接转为断言）。若选 018 路线乙或 009 修法甲，需额外付出「修正 changeObject 声明并补更重档分析线」或「调整路由表」的前置成本。",
      "risk": [
        "档位风险（高，且已确知）：现行路由表对 .gitattributes 与 .github/** 没有任何路径前缀命中，按未匹配取最重档（99）。本条目声明 tool-code（20），故一旦实际改动触及这两处，guard verify 的声明与事实交叉校验必然拒绝。这不是实施期才会暴露的意外，而是方案门就必须裁掉的前置条件：要么本批次不碰这两处，要么按路由表自述的口径调表，要么改声明并补更重档分析线。",
        "回落风险（中）：018 走甲会让入口在找不到 manifest 时改走消费仓探测，若不加边界断言，真正的未初始化场景会被这条回落掩盖成另一种错误。",
        "行尾风险（中）：009 走甲会触发一次大面积形式化 diff，可能淹没同批次的实质改动，使 Review 难以聚焦。缓解方式是把行尾重写单独成一个提交。",
        "误判残留（低）：只做 010+011 修法甲不缩短路径，预算余量仍为零；下一条超长证据路径会以同样方式再犯，且届时同样不可追溯（除非同时做 stderr 入报告）。",